{
  "schema_version": "1",
  "timestamp": "2026-03-30T04:54:41Z",
  "git_sha": "09dd13c",
  "trigger": "schedule",
  "pr_number": null,
  "suite": "framework-eval",
  "model": "mlx-community/Qwen3.5-122B-A10B-4bit",
  "system": {
    "os": "macOS 15.7.4",
    "chip": "Apple M1 (Virtual)",
    "memory_gb": 7,
    "vllm_mlx_version": "unknown",
    "runner": "GitHub Actions 1000054225"
  },
  "results": [],
  "errors": [
    "eval_langgraph.py: exited 1: Traceback (most recent call last):\n  File \"/Users/runner/work/nix-ai/nix-ai/orchestrator/examples/evaluations/eval_langgraph.py\", line 7, in <module>\n    from openai import OpenAI\nModuleNotFoundError:",
    "eval_qwen_agent.py: exited 1: Downloading dashscope (1.3MiB)\nDownloading pydantic-core (1.8MiB)\nDownloading pillow (4.4MiB)\nDownloading qwen-agent (6.8MiB)\nDownloading openai (1.1MiB)\nDownloading cryptography (6.8MiB)\nDownloading ",
    "eval_smolagents.py: exited 1: Downloading pygments (1.2MiB)\nDownloading hf-xet (3.4MiB)\n Downloaded hf-xet\n Downloaded pygments\nInstalled 22 packages in 22ms\nTraceback (most recent call last):\n  File \"/Users/runner/.cache/uv/envir",
    "eval_google_adk.py: exited 1: Downloading google-cloud-aiplatform (8.0MiB)\nDownloading google-cloud-discoveryengine (3.2MiB)\nDownloading google-api-python-client (14.2MiB)\nDownloading google-adk (2.6MiB)\nDownloading grpcio (11.3Mi"
  ]
}
